{
  "$schema": "https://json-schema.org/draft/2020-12/schema",
  "$id": "human-ai-communication-proof-chain-review-v2",
  "type": "object",
  "required": ["schema_version", "task_id", "decision", "validation_provenance", "human_authority", "role_authority", "actor_origin", "state_freshness", "release_binding", "drift_history", "self_authentication_prohibited"],
  "properties": {
    "schema_version": {"const": "human_ai.communication_proof_chain_review.v2"},
    "task_id": {"const": "human-ai-communication-compliance-gate-0001"},
    "decision": {"const": "implemented_awaiting_exact_head_review"},
    "validation_provenance": {"type": "object"},
    "human_authority": {"type": "object"},
    "role_authority": {"type": "object"},
    "actor_origin": {"type": "object"},
    "state_freshness": {"type": "object"},
    "release_binding": {"type": "object"},
    "drift_history": {"type": "object"},
    "self_authentication_prohibited": {"const": true}
  },
  "additionalProperties": false
}
